{"aggregate":{"all_valid":true,"probes_failed":0,"probes_run":2,"probes_valid":2,"total_vectors":25},"artifact_kind":"validation","created_at_utc":"2026-06-20T06:50:30Z","disposition_authority":"none — raw-fact producer output; not a gatekeeper disposition","host":{"macos":"27.0","os":"Darwin mm4.local 27.0.0 Darwin Kernel Version 27.0.0: Wed May 27 02:11:37 PDT 2026; root:xnu-13361.0.0.501.1~2/RELEASE_ARM64_T8132 arm64"},"lane":"A","mode":"explorer","namespace":"sx-r64z / mx-a64z","probes":[{"issues":[],"name":"integer_overflow","observed_vector_count":5,"probe_id":"lane-a.integer-overflow.v1","return_code":0,"source_sha256":"f5f4f7a636e41df0e207f6a61b5d2f34bd66f1ea33e4f31aa9edb1f3c4a946d9","valid":true,"vector_count":5,"vectors":[{"checked_overflow":true,"checked_value":-9223372036854775808,"expr":"Int.max +&+ 1","probe_id":"lane-a.integer-overflow.v1","wrapped_value":-9223372036854775808},{"checked_overflow":true,"checked_value":-2,"expr":"Int.max +&+ Int.max","probe_id":"lane-a.integer-overflow.v1","wrapped_value":-2},{"checked_overflow":true,"checked_value":9223372036854775807,"expr":"Int.min -&- 1","probe_id":"lane-a.integer-overflow.v1","wrapped_value":9223372036854775807},{"checked_overflow":true,"checked_value":9223372036854775803,"expr":"5 *&* Int.max","probe_id":"lane-a.integer-overflow.v1","wrapped_value":9223372036854775803},{"checked_overflow":false,"checked_value":9223372036854775807,"expr":"Int.max +&+ 0 (control)","probe_id":"lane-a.integer-overflow.v1","wrapped_value":9223372036854775807}]},{"issues":[],"name":"type_layout","observed_vector_count":20,"probe_id":"lane-a.type-layout.v1","return_code":0,"source_sha256":"18e299a88489520db88852d1d4bc721b57ea4561191520c3762c974b8012c586","valid":true,"vector_count":20,"vectors":[{"alignment":8,"kind":"builtin","probe_id":"lane-a.type-layout.v1","size":8,"stride":8,"type":"Int"},{"alignment":8,"kind":"builtin","probe_id":"lane-a.type-layout.v1","size":8,"stride":8,"type":"Int64"},{"alignment":4,"kind":"builtin","probe_id":"lane-a.type-layout.v1","size":4,"stride":4,"type":"Int32"},{"alignment":1,"kind":"builtin","probe_id":"lane-a.type-layout.v1","size":1,"stride":1,"type":"Int8"},{"alignment":8,"kind":"builtin","probe_id":"lane-a.type-layout.v1","size":8,"stride":8,"type":"UInt"},{"alignment":8,"kind":"builtin","probe_id":"lane-a.type-layout.v1","size":8,"stride":8,"type":"Double"},{"alignment":4,"kind":"builtin","probe_id":"lane-a.type-layout.v1","size":4,"stride":4,"type":"Float"},{"alignment":1,"kind":"builtin","probe_id":"lane-a.type-layout.v1","size":1,"stride":1,"type":"Bool"},{"alignment":8,"kind":"builtin","probe_id":"lane-a.type-layout.v1","size":16,"stride":16,"type":"Character"},{"alignment":8,"kind":"builtin","probe_id":"lane-a.type-layout.v1","size":16,"stride":16,"type":"String"},{"alignment":1,"kind":"struct","probe_id":"lane-a.type-layout.v1","size":0,"stride":1,"type":"Empty"},{"alignment":8,"kind":"struct","probe_id":"lane-a.type-layout.v1","size":8,"stride":8,"type":"SingleInt"},{"alignment":8,"kind":"struct","probe_id":"lane-a.type-layout.v1","size":16,"stride":16,"type":"PairIntDouble"},{"alignment":8,"kind":"struct","probe_id":"lane-a.type-layout.v1","size":16,"stride":16,"type":"PaddedTuple"},{"alignment":1,"kind":"enum","probe_id":"lane-a.type-layout.v1","size":1,"stride":1,"type":"VoidlessEnum"},{"alignment":8,"kind":"optional","probe_id":"lane-a.type-layout.v1","size":9,"stride":16,"type":"Optional<Int>"},{"alignment":8,"kind":"generic-struct","probe_id":"lane-a.type-layout.v1","size":8,"stride":8,"type":"GenericBox<Int>"},{"alignment":8,"kind":"array","probe_id":"lane-a.type-layout.v1","size":8,"stride":8,"type":"Array<Int>"},{"alignment":8,"kind":"class","probe_id":"lane-a.type-layout.v1","size":8,"stride":8,"type":"FinalBox"},{"alignment":8,"kind":"pointer","probe_id":"lane-a.type-layout.v1","size":8,"stride":8,"type":"UnsafeRawPointer"}]}],"repo":{"dirty":true,"head":"feb103c0c0ebc38a1dfa4e90443e1998e8223d13","path":"/Users/linz/Local/swift-rx/swift-rx-explorer"},"run_dir":"artifacts/explorer-mx-a64z/block-017/lane-a-run","schema":"sx-r64z.lane-a-vectors.v1","tool_versions":{"elixir":"Erlang/OTP 29 [erts-17.0] [source] [64-bit] [smp:10:10] [ds:10:10:10] [async-threads:1] [jit]\n\nElixir 1.20.0 (compiled with Erlang/OTP 28)","otp":"29","zig":"0.16.0"},"toolchain":{"macos":"27.0","swift_bin":"/Applications/Xcode-beta.app/Contents/Developer/Toolchains/XcodeDefault.xctoolchain/usr/bin/swift","swift_sha256":"2b8614a533f97a45159aa9fbccdbc8dcde8b5e37e2c6c3eeb9684d87365deb57","swift_version":"swift-driver version: 1.167 Apple Swift version 6.4 (swiftlang-6.4.0.20.104 clang-2100.3.20.102)"}}
